{
  "id": "yokohama-nyusatsu",
  "region": "yokohama",
  "organizationType": "issuer",
  "name": "横浜市（入札・契約）",
  "publisher": "横浜市（財政局契約第一課ほか）",
  "baseUrl": "https://www.city.yokohama.lg.jp/business/nyusatsu/",
  "allowedHost": "www.city.yokohama.lg.jp",
  "authority": "primary_official",
  "format": "HTML",
  "fetchMode": "manual",
  "ttlDays": 180,
  "license": {
    "url": "https://www.city.yokohama.lg.jp/aboutweb/sitepolicy.html",
    "summary": "著作権は原則横浜市所有（既定は制限型：私的使用・引用等を除き無断複製・転用不可）。CC BY 4.0 が明記されたページ/データのみ出典表示のもと商用含む二次利用可。数値データ・簡単な表等は自由利用。",
    "reuse": "reference_only",
    "confirmedAt": "2026-07-24",
    "confirmedBy": "kensan1969（Issue #28 決裁・PR マージ承認で確定）"
  },
  "active": true,
  "notes": "工事の一般競争入札は別ドメイン「ヨコハマ・入札のとびら」(keiyaku.city.yokohama.lg.jp)。"
}
