{
  "id": "tokyo-kensetsu-river",
  "region": "tokyo",
  "organizationType": "river_admin",
  "name": "東京都建設局（河川の管理と活用）",
  "publisher": "東京都建設局",
  "baseUrl": "https://www.kensetsu.metro.tokyo.lg.jp/river/kanri",
  "allowedHost": "www.kensetsu.metro.tokyo.lg.jp",
  "authority": "primary_official",
  "format": "HTML",
  "fetchMode": "manual",
  "ttlDays": 180,
  "license": {
    "url": "https://www.metro.tokyo.lg.jp/policy/chosakuken",
    "summary": "東京都公式HPの著作権ポリシー（制限型）。私的使用・引用等を除き無断複製・転用は不可。",
    "reuse": "reference_only",
    "confirmedAt": "2026-07-24",
    "confirmedBy": "kensan1969（Issue #28 決裁・PR マージ承認で確定）"
  },
  "active": true,
  "notes": "河川敷地占用の申請様式は /river/yoshiki/kasen_shikichi。建設局河川部が所管。"
}
