{
  "id": "mlit-ksj-w05",
  "region": "national",
  "organizationType": "river_admin",
  "name": "国土数値情報 河川データ（W05）",
  "publisher": "国土交通省 国土数値情報ダウンロードサービス",
  "baseUrl": "https://nlftp.mlit.go.jp/ksj/gml/datalist/KsjTmplt-W05.html",
  "allowedHost": "nlftp.mlit.go.jp",
  "authority": "primary_official",
  "format": "GML",
  "fetchMode": "manual",
  "ttlDays": 365,
  "license": {
    "url": "https://www.mlit.go.jp/kokudosiseki/copyright.html",
    "summary": "国土数値情報 使用許諾条件（非商用）準拠。出典記載（国土数値情報（河川データ））を条件に利用可。商用利用の場合は許諾条件の確認が必要。",
    "reuse": "non_commercial",
    "confirmedAt": "2026-08-15",
    "confirmedBy": "CTO 代行（2026-08-15・河川管轄ポリゴン整備）"
  },
  "active": true,
  "notes": "全国の河川ラインデータ（Stream）。河川名で集約し、代表3地域の主要河川から管轄区域として整備する。ラインデータはバッファまたは行政区域との重なりで管轄表現する。CRS を EPSG:4326 へ変換してからステージング取込する。"
}
